{
  "$schema": "https://json-schema.org/draft/2020-12/schema",
  "$id": "https://criticalflow.ai/schemas/ibmz-event/1.0.0",
  "title": "CriticalFlow AI IBM Z Event",
  "type": "object",
  "additionalProperties": false,
  "required": [
    "schema_version", "incident_id", "timestamp", "system_id", "subsystem",
    "job_name", "job_id", "step_name", "completion_status", "return_code",
    "abend_code", "primary_message_id", "cpu_utilization_pct", "error_rate_pct",
    "transaction_volume_per_hr", "recent_deployment_flag", "raw_log_snippet"
  ],
  "properties": {
    "schema_version": { "const": "1.0.0" },
    "incident_id": { "type": "string", "pattern": "^INC-\\d{8}-(JOB|STC|TSU)\\d{5,8}-[A-Z#@$][A-Z0-9#@$]{0,7}$" },
    "timestamp": { "type": "string", "pattern": "^\\d{4}-\\d{2}-\\d{2}T\\d{2}:\\d{2}:\\d{2}Z$" },
    "system_id": { "type": "string", "pattern": "^[A-Z0-9#@$]{1,8}$" },
    "subsystem": { "type": "string", "pattern": "^[A-Z0-9-]{2,32}$" },
    "job_name": { "type": "string", "pattern": "^[A-Z#@$][A-Z0-9#@$]{0,7}$" },
    "job_id": { "type": "string", "pattern": "^(JOB|STC|TSU)\\d{5,8}$" },
    "step_name": { "type": "string", "pattern": "^[A-Z#@$][A-Z0-9#@$]{0,7}$" },
    "completion_status": { "enum": ["CC", "ABEND", "JCL_ERROR"] },
    "return_code": { "type": ["integer", "null"], "minimum": 0, "maximum": 4095 },
    "abend_code": { "type": ["string", "null"], "pattern": "^(S[0-9A-F]{3}|U\\d{4})$" },
    "primary_message_id": { "type": ["string", "null"], "pattern": "^\\$?[A-Z]{3,4}\\d{3,5}[A-Z]?$" },
    "cpu_utilization_pct": { "type": ["number", "null"], "minimum": 0, "maximum": 100 },
    "error_rate_pct": { "type": ["number", "null"], "minimum": 0, "maximum": 100 },
    "transaction_volume_per_hr": { "type": ["integer", "null"], "minimum": 0 },
    "recent_deployment_flag": { "type": "boolean" },
    "raw_log_snippet": { "type": "string", "minLength": 1, "maxLength": 4000 }
  },
  "allOf": [
    {
      "if": { "properties": { "completion_status": { "const": "CC" } } },
      "then": { "properties": { "return_code": { "type": "integer" }, "abend_code": { "type": "null" } } }
    },
    {
      "if": { "properties": { "completion_status": { "const": "ABEND" } } },
      "then": { "properties": { "return_code": { "type": "null" }, "abend_code": { "type": "string" } } }
    },
    {
      "if": { "properties": { "completion_status": { "const": "JCL_ERROR" } } },
      "then": { "properties": { "return_code": { "type": "null" }, "abend_code": { "type": "null" } } }
    }
  ]
}
