{
  "schema_version": "1.0.0",
  "incident_id": "INC-20260930-JOB05581-PAYAUTH2",
  "timestamp": "2026-09-30T14:44:38Z",
  "system_id": "SYSA",
  "subsystem": "CICS-PROD",
  "job_name": "PAYAUTH2",
  "job_id": "JOB05581",
  "step_name": "STEP020",
  "completion_status": "ABEND",
  "return_code": null,
  "abend_code": "S0C4",
  "primary_message_id": "IEF450I",
  "cpu_utilization_pct": 71.8,
  "error_rate_pct": 3.7,
  "transaction_volume_per_hr": 241300,
  "recent_deployment_flag": true,
  "raw_log_snippet": "14.42.10 JOB05581  $HASP373 PAYAUTH2 STARTED - INIT 5    - CLASS A - SYS SYSA\n14.42.10 JOB05581  IEF403I PAYAUTH2 - STARTED - TIME=14.42.10\n14.43.02 JOB05581  IEF142I PAYAUTH2 STEP010 - STEP WAS EXECUTED - COND CODE 0000\n14.44.37 JOB05581  IEA995I SYMPTOM DUMP OUTPUT\n14.44.37 JOB05581    SYSTEM COMPLETION CODE=0C4  REASON CODE=00000004\n14.44.37 JOB05581    PSW AT TIME OF ERROR  078D1000   8A3F2E44  ILC 4  INTC 04\n14.44.37 JOB05581    ACTIVE LOAD MODULE           ADDRESS=0A3F1000  OFFSET=00001E44 (PAYAUTH)\n14.44.37 JOB05581  IEF450I PAYAUTH2 STEP020 - ABEND=S0C4 U0000 REASON=00000004 TIME=14.44.37\n14.44.37 JOB05581  CFMETRIC SUBSYS=CICS-PROD SYSID=SYSA CPU_PCT=71.8 ERR_PCT=3.7 TPH=241300 DEPLOY=Y\n14.44.38 JOB05581  IEF404I PAYAUTH2 - ENDED - TIME=14.44.38\n14.44.38 JOB05581  $HASP395 PAYAUTH2 ENDED - ABEND=S0C4"
}
