{
  "schema_version": "1.0.0",
  "incident_id": "INC-20261011-JOB03536-Z75376B",
  "timestamp": "2026-10-11T05:08:47Z",
  "system_id": "S0W1",
  "subsystem": "PAYMENT-API",
  "job_name": "Z75376B",
  "job_id": "JOB03536",
  "step_name": "STEP020",
  "completion_status": "ABEND",
  "return_code": null,
  "abend_code": "S806",
  "primary_message_id": "IEF450I",
  "cpu_utilization_pct": null,
  "error_rate_pct": null,
  "transaction_volume_per_hr": null,
  "recent_deployment_flag": false,
  "raw_log_snippet": "00.08.43 JOB03536  $HASP373 Z75376B  STARTED - INIT 2    - CLASS 7        - SYS S0W1\n00.08.43 JOB03536  -STEPNAME PROCSTEP    RC   EXCP   CONN       TCB       SRB  CLOCK          SERV  WORKLOAD  PAGE  SWAP   VIO SWAPS\n00.08.47 JOB03536  IEA848I NO DUMP WAS PRODUCED FOR THIS ABEND, DUE TO SYSTEM OR INSTALLATION REQUEST\n00.08.47 JOB03536  IEF450I Z75376B STEP020 - ABEND=S806 U0000 REASON=00000004\n00.08.47 JOB03536  $HASP395 Z75376B  ENDED - ABEND=S806\nIEF142I Z75376B STEP010 - STEP WAS EXECUTED - COND CODE 0000\nIEF373I STEP/STEP010 /START 2026284.0008\nIEF032I STEP/STEP010 /STOP  2026284.0008\nIEF285I   SYS26284.T000844.RA000.Z75376B.T7799954.H01  DELETED\nIEF237I DMY  ALLOCATED TO IDITRACE\nIEF237I 0D2F ALLOCATED TO SYS00003\nIEF285I   VENDOR.PARMLIB                               KEPT\nIEF285I   VOL SER NOS= VPMVSE.\nIEF237I 1005 ALLOCATED TO SYS00004\nIEF285I   SVTSC.PARMLIB                                KEPT\nIEF285I   VOL SER NOS= VTMVSG.\nIEF237I 100E ALLOCATED TO SYS00005\nIEF285I   LVL0.PARMLIB                                 KEPT\nIEF285I   VOL SER NOS= VTLVL0.\nIEF237I 1000 ALLOCATED TO SYS00006\nIEF285I   SYS1.PARMLIB                                 KEPT\nIEF285I   VOL SER NOS= VIMVSB.\nIEF237I 0D2F ALLOCATED TO SYS00007\nIEF285I   VENDOR.PARMLIB                               KEPT\nIEF285I   VOL SER NOS= VPMVSE.\nIEF237I 1005 ALLOCATED TO SYS00008\nIEF285I   SVTSC.PARMLIB                                KEPT\nIEF285I   VOL SER NOS= VTMVSG.\nIEF237I 100E ALLOCATED TO SYS00009\nIEF285I   LVL0.PARMLIB                                 KEPT\nIEF285I   VOL SER NOS= VTLVL0.\nIEF237I 1000 ALLOCATED TO SYS00010\nIEF285I   SYS1.PARMLIB                                 KEPT\nIEF285I   VOL SER NOS= VIMVSB.\nIEF237I 0D2F ALLOCATED TO SYS00011\nIEF285I   VENDOR.PARMLIB                               KEPT\nIEF285I   VOL SER NOS= VPMVSE.\nIEF237I 1005 ALLOCATED TO SYS00012\nIEF285I   SVTSC.PARMLIB                                KEPT\nIEF285I   VOL SER NOS= VTMVSG.\nIEF237I 1D70 ALLOCATED TO SYS00013\nIEF285I   ISM402.SIDIDOC1                              KEPT\nIEF285I   VOL SER NOS= VTISMH.\nIEF237I 1D72 ALLOCATED TO SYS00014\nIEF237I 1D70 ALLOCATED TO SYS00015\nIEF285I   ISM402.SIDIMAPS                              KEPT\nIEF285I   VOL SER NOS= VTISMH.\nIEF237I 1D72 ALLOCATED TO SYS00017\nIEF237I JES2 ALLOCATED TO IDIREPRT\nIEF237I 1D70 ALLOCATED TO SYS00018\nIEF237I 1D70 ALLOCATED TO SYS00019\nIEF237I 1D72 ALLOCATED TO SYS00020\nIEF237I 1D70 ALLOCATED TO SYS00021\nIEF237I 1D70 ALLOCATED TO SYS00022\nIEF237I 1D70 ALLOCATED TO SYS00023\nIEF285I   ISM402.SIDIDOC1                              KEPT\nIEF285I   VOL SER NOS= VTISMH.\nIEF237I DMY  ALLOCATED TO SYS00024\nIEF237I 1D70 ALLOCATED TO SYS00025\nIEF285I   ISM402.SIDIMAPS                              KEPT\nIEF285I   VOL SER NOS= VTISMH.\nIEF237I 1D72 ALLOCATED TO SYS00026\nIEF285I   ISM402.HIST                                  KEPT\nIEF285I   VOL SER NOS= VPISMH.\nIEF285I   ISM402.SIDIDOC1                              KEPT\nIEF285I   VOL SER NOS= VTISMH.\nIEF285I   ISM402.SIDIDOC1                              KEPT\nIEF285I   VOL SER NOS= VTISMH.\nIEF285I   ISM402.SIDIDOC1                              KEPT\nIEF285I   VOL SER NOS= VTISMH.\nIEF285I   ISM402.SIDIDOC1                              KEPT\nIEF285I   VOL SER NOS= VTISMH.\nIEF285I   Z75376.Z75376B.JOB03536.D0000101.?           SYSOUT\nIEA848I NO DUMP WAS PRODUCED FOR THIS ABEND, DUE TO SYSTEM OR INSTALLATION REQUEST\nIEF472I Z75376B STEP020 - COMPLETION CODE - SYSTEM=806 USER=0000 REASON=00000004\nIEF373I STEP/STEP020 /START 2026284.0008\nIEF032I STEP/STEP020 /STOP  2026284.0008\nIEF375I  JOB/Z75376B /START 2026284.0008\nIEF033I  JOB/Z75376B /STOP  2026284.0008\nCFMETRIC SUBSYS=PAYMENT-API DEPLOY=N"
}
